Granted Powers,Description
Vermin Friend (Ex),"You can use wild empathy to influence vermin as easily as you influence animals if you do not already possess this ability.",
Tremorsense (Ex),"At 6th level, you gain tremorsense 30 feet. At 12th level, you gain tremorsense 60 feet.",
Guarded Mind (Ex),"You gain a +2 insight bonus on saving throws against all mind-affecting effects.",
Part the Veil (Su),"At 8th level, you can lace spells you cast with the raw madness that waits in the outer darkness. Activating this ability is a swift action that you must use as you cast a spell that targets a single creature and that allows a Will saving throw to negate or reduce the spell's primary effect. If the target fails to resist the spell, the target is also confused for a number of rounds equal to the spell's level as visions of the void cause temporary insanity. The victim must succeed at a new saving throw each round to end the effect—these additional saving throws apply only to the additional confusion effect and not to the original spell effect. Part the veil is a mind-affecting effect. You can use this ability a number of times per day equal to 1/2 your class level.",
It Came from Beyond (Su),"Once per day, when you cast a summoning spell, any one creature you summon is more powerful than normal. The creature gains the advanced creature simple template. If you summon more than one creature with a spell, only one of the summoned creatures gains the advanced creature simple template. A summoned creature that gains the advanced creature simple template in this manner appears unnervingly deformed or unnaturally hideous, bringing with it a whiff of the emptiness of the void. This ability works only on spells you cast as a cleric—it does not work on spellcasting abilities gained from any other spellcasting classes you might have.",
Aura of Isolation (Su),"As a standard action, you can create a 20-foot aura that causes enemies within to be overcome with feelings of isolation and loss. Your enemies treat the aura as difficult terrain, as they become sluggish within its area of effect. Furthermore, while within the aura, your enemies cannot provide flanking, nor can they use or benefit from the aid another action. The aura lasts for a number of rounds equal to 3 + your Wisdom modifier, but the rounds need not be consecutive. This is a mind-affecting emotion effect.",
The Stars Are Right (Su),"If you prepare your cleric spells while the stars are visible to you, you may spontaneously cast any of your Stars subdomain spells by swapping out a spell of an equal spell level. Any Stars subdomain spell that you cast while the stars are visible to you heals you of an amount of hit point damage equal to the spell's level; this effect happens as you cast the spell.",
Battle Rage (Sp),"You can touch a creature as a standard action to give it a bonus on melee damage rolls equal to 1/2 your cleric level for 1 round (minimum +1). You can do so a number of times per day equal to 3 + your Wisdom modifier",
Weapon Master (Su),"At 8th level, as a swift action, you gain the use of one combat feat for a number of rounds per day equal to your cleric level. These rounds do not need to be consecutive and you can change the feat chosen each time you use this ability. You must meet the prerequisites to use this feat.",
Wounding Blade (Su),"At 8th level, you can give a weapon that you touch the wounding special weapon quality for a number of rounds equal to 1/2 your cleric level. You can use this ability once per day at 8th level, and an additional time per day for every four levels beyond 8th.",
Divine Challenge (Su),"As a swift action, you can challenge a visible foe within 30 feet, gaining a +1 sacred bonus to your AC against that creature's attacks and a bonus equal to 1/2 your cleric level on Bluff skill checks to feint against it. These bonuses last for a number of rounds equal to 1/2 your cleric level. You can use this ability a number of times per day equal to 3 + your Wisdom modifier.",
Seize the Initiative (Su),"Whenever you and your allies roll for initiative, you can grant one ally within 30 feet the ability to roll twice and take either result. This decision is made before results are revealed. You can use this ability a number of times per day equal to 3 + your Wisdom modifier.",
Icicle (Sp),"As a standard action, you can fire an icicle from your finger, targeting any foe within 30 feet as a ranged touch attack. The icicle deals 1d6 points of cold damage + 1 point for every two cleric levels you possess. You can use this ability a number of times per day equal to 3 + your Wisdom modifier.",
Cold Resistance (Ex),"At 6th level, you gain resist cold 10. This resistance increases to 20 at 12th level. At 20th level, you gain immunity to cold.",
Sift (Su),"At 6th level, once per day you can reach into water as a standard action and pull out an object with a maximum gp value of up to 50 gp × your cleric level. This object always has the broken condition upon being withdrawn from the water. The water you reach into must be at least deep enough to fully immerse yourself in it. At 12th level, objects you retrieve are not broken. At 20th level, you can retrieve objects worth up to 5,000 gp. If retrieving an object that would not normally float, assume it rests on top of or is entwined with debris that does float. Objects retrieved in this manner disappear after 24 hours, if not already used up or otherwise destroyed before then.",
Go with the Flow (Su),"You can touch a creature as a standard action to suppress its strong emotions. The target is affected as the calm emotions spell, except it can still take violent actions and violent actions against the target do not end the effect. This effect lasts a number of rounds equal to 1/2 your cleric level (minimum 1). You can use this ability a number times per day equal to 3 + your Wisdom modifier.",
Body of Ice (Su),"At 8th level, you can transmute your body and equipment to ice for a period of time. It takes a standard action to take on the form of ice, and you can end the transmutation with a free action on your turn. When you take on the form of ice, you are immune to cold and have DR 5/—, but you take twice the normal amount of damage from fire. You can take on the form of ice for a number of rounds per day equal to your cleric level. The rounds need not be consecutive.",
Surge (Su),"As a standard action, you can cause a mighty wave to appear that pushes or pulls a single creature. Make a combat maneuver check against the target, using your cleric level + your Wisdom modifier as your CMB. If successful, you may pull or push the creature as if using the bull rush or drag combat maneuver. You can use this ability a number of times per day equal to 3 + your Wisdom modifier.",
Current Flow (Su),"As a free action, you can increase either your land or swim speed by 10 feet. While swimming, you gain a bonus on Swim checks equal to your 1/2 your cleric level (minimum 1). These effects last for a number of rounds equal to your Wisdom modifier (minimum 1). You can use this ability a number of times per day equal to 3 + your Wisdom modifier.",
Storm Burst (Sp),"As a standard action, you can create a storm burst targeting any foe within 30 feet as a ranged touch attack. The storm burst deals 1d6 points of nonlethal damage + 1 point for every two cleric levels you possess. In addition, the target is buffeted by winds and rain, causing it to take a –2 penalty on attack rolls for 1 round. You can use this ability a number of times per day equal to 3 + your Wisdom modifier.",
Lightning Lord (Sp),"At 8th level, you can call down a number of bolts of lightning per day equal to your cleric level. You can call down as many bolts as you want with a single standard action, but no creature can be the target of more than one bolt and no two targets can be more than 30 feet apart. This ability otherwise functions as call lightning.".
Untouched by the Seasons (Su),"By touching a creature, you can grant it the benefits of endure elements, which last for 1 hour per cleric level. You can use this ability a number of times per day equal to 3 + your Wisdom modifier.",
Gale Aura (Su),"At 6th level, as a standard action, you can create a 30-foot aura of gale-like winds that slows the progress of enemies. Creatures in the aura cannot take a 5-foot step. Enemies in the aura treat each square that brings them closer to you as difficult terrain. They can move normally in any other direction. You can use this ability for a number of rounds per day equal to your cleric level. The rounds do not need to be consecutive.",
