Granted Powers,Description
Spark Malfeasance (Su),"At 8th level, you can awaken the sinful desires of a target within 30 feet with a ranged touch attack. The target suffers extreme guilt and is sickened for a number of rounds equal to 1/2 your cleric level. To end the effect earlier, the target can willingly commit an evil act (if it is of good alignment) or attempt a Will save (DC = 10 + 1/2 your cleric level + your Wisdom modifier) at the beginning of its turn each round. Creatures that succeed at their saving throws are immune to this ability for 24 hours. You can use this ability once per day at 8th level, and an additional time per day for every 4 levels beyond 8th.",
Whispering Evil (Su),"At 8th level, as a standard action, you can whisper a hypnotizing litany of empty promises. Each enemy within a 30-foot emanation that can hear you must succeed on a Will saving throw or become fascinated for as long as you continue the litany. You can use this power a number of rounds per day equal to your cleric level, but these rounds do not need to be consecutive. This is a mind-affecting effect.,"
Faith-Stealing Strike (Su),"You can make a single melee attack using your highest base attack bonus against a creature capable of casting divine spells. If you damage the creature, it must succeed at a Will save (DC = 10 + 1/2 your cleric level + your Wisdom modifier) or be unable to cast any divine spells for 1 round. If you do not damage your target with the attack, this ability is expended with no effect. You can use this ability a number of times per day equal to 3 + your Wisdom modifier.",
Fury of the Abyss (Su),"As a swift action, you can give yourself an enhancement bonus equal to 1/2 your cleric level (minimum +1) on melee attacks, melee damage rolls, and combat maneuver checks. This bonus lasts for 1 round. During this round, you take a –2 penalty to AC. You can use this ability for a number of times per day equal to 3 + your Wisdom modifier.",
Hell’s Corruption (Su),"You can cause a creature to become more susceptible to corruption as a melee touch attack. Creatures touched take a –2 penalty on all saving throws and must roll all opposed skill checks twice, taking the worse result. This effect lasts for a number of rounds equal to 1/2 your cleric level (minimum 1). You can use this ability for a number of times per day equal to 3 + your Wisdom modifier.",
Feed on Fear (Su),"At 8th level, as an immediate action upon successfully hitting a creature with a melee attack that's already suffering from a fear effect, you deal 2d6 extra points of damage and gain that amount in temporary hit points. These temporary hit points last for 24 hours or until lost. You can use this ability once per day at 8th level, and an additional time per day for every 4 levels beyond 8th.,"
Pain Is Power (Su),"At 8th level, after taking damage from any source, you may attempt a DC 25 concentration check as an immediate action. If you succeed, you gain the benefits of a blessing of fervor spell for a number of rounds equal to 1/2 your cleric level. If you fail, this ability is expended with no effect. You can use this ability once at 8th level, plus an additional time for every 4 levels you are beyond 8th.",
Touch of Virulence (Su),"As a standard action, you can touch a diseased creature and exacerbate its condition. If it fails a Fortitude save (DC = 10 + 1/2 your cleric level + your Wisdom modifier), the creature takes damage as though it had failed its Fortitude save against the disease and any remaining onset time for the disease ends. You can use this ability once per day at 8th level, plus one additional time per day at 14th level and 20th level.",
Fire Bolt (Sp),"As a standard action, you can unleash a scorching bolt of divine fire from your outstretched hand. You can target any single foe within 30 feet as a ranged touch attack with this bolt of fire. If you hit the foe, the fire bolt deals 1d6 points of fire damage + 1 point for every two cleric levels you possess. You can use this ability a number of times per day equal to 3 + your Wisdom modifier.",
Fire Resistance (Ex),"At 6th level, you gain resist fire 10. This resistance increases to 20 at 12th level. At 20th level, you gain immunity to fire.",
Call Fire (Su),"As a standard action, you can stretch out your hand toward any visible fire source within 60 feet and beckon it toward you. This causes a ribbon-thin streak of fire to approach you in a straight line through the air. Any creature directly in the fire ribbon's path takes 1d4 points of fire damage; a successful Reflex save (DC = 10 + 1/2 your cleric level + your Wisdom modifier) negates this damage. When the ribbon of fire reaches your hand, it either extinguishes or lights a flammable object of your choice that you're holding. You can use this ability a number of times per day equal to 3 + your Wisdom modifier.",
Wall of Ashes (Su),"At 8th level, you can create a wall of swirling ashes anywhere within 100 feet. This wall is up to 20 feet high and up to 10 feet long per cleric level you possess. The wall of ash blocks line of sight, and any creature passing through it must make a Fortitude save or be blinded for 1d4 rounds. The wall of ash reveals invisible creatures that are inside it or adjacent to it, although they become invisible again if they move away from the wall. You can use this ability for a number of minutes per day equal to your cleric level, but these minutes do not need to be consecutive.",
Cloud of Smoke (Su),"As a standard action, you can create a 5-foot-radius cloud of smoke. This power has a range of 30 feet. Creatures inside the cloud take a –2 penalty on attack rolls and Perception skill checks for as long as they remain inside and for 1 round after exiting the cloud. Creatures inside the cloud gain concealment from attacks made by opponents that are not adjacent to them. You can use this ability a number of times per day equal to 3 + your Wisdom modifier.",
Touch of Glory (Sp),"You can cause your hand to shimmer with divine radiance, allowing you to touch a creature as a standard action and give it a bonus equal to your cleric level on a single Charisma-based skill check or Charisma ability check. This ability lasts for 1 hour or until the creature touched elects to apply the bonus to a roll. You can use this ability to grant the bonus a number of times per day equal to 3 + your Wisdom modifier.",
Divine Presence (Su),"At 8th level, you can emit a 30-foot aura of divine presence for a number of rounds per day equal to your cleric level. All allies within this aura are treated as if under the effects of a sanctuary spell with a DC equal to 10 + 1/2 your cleric level + your Wisdom modifier. These rounds do not need to be consecutive. Activating this ability is a standard action. If an ally leaves the area or makes an attack, the effect ends for that ally. If you make an attack, the effect ends for you and your allies.",
Aura of Heroism (Su),"At 8th level, you can emit a 30-foot aura of heroism for a number of rounds per day equal to your cleric level. Using this ability is a swift action. Allies in the area are treated as if they were under the effects of heroism. These rounds do not need to be consecutive.",
Honor Bound (Su),"With a touch, you can remind a creature of its duties and responsibilities, granting it a new saving throw against each enchantment (charm) or enchantment (compulsion) effect that currently affects it. If the saving throw is successful, the enchantment effect is ended. This power only affects effects that allow a save. If you fail a save against such an effect, you can use this ability as an immediate action to grant yourself an additional save. Once the target (either you or a touched creature) has made one additional save per effect, this ability has no further effect on that particular enchantment effect. You can use this ability a number of times per day equal to 3 + your Wisdom modifier.",
Touch of Good (Sp),"You can touch a creature as a standard action, granting a sacred bonus on attack rolls, skill checks, ability checks, and saving throws equal to half your cleric level (minimum 1) for 1 round. You can use this ability a number of times per day equal to 3 + your Wisdom modifier.",
Holy Lance (Su),"At 8th level, you can give a weapon you touch the holy special weapon quality for a number of rounds equal to 1/2 your cleric level. You can use this ability once per day at 8th level, and an additional time per day for every four levels beyond 8th.",
Protective Aura (Su),"At 8th level, you can emit a 30-foot protective aura as a standard action. Allies in this aura receive a +2 deflection bonus to AC and a +2 resistance bonus on all saving throws. In addition, allies in the area gain the benefits of protection from evil (although the AC bonus and saving throw bonus do not stack with those granted by this effect). You can use this ability for a number of rounds per day equal to your cleric level. These rounds do not have to be consecutive.",
Aura of Menace (Su),"At 8th level, you can emit a 30-foot aura of menace as a standard action. Enemies in this aura take a –2 penalty to AC and on attacks and saves as long as they remain inside the aura. You can use this ability for a number of rounds per day equal to your cleric level. These rounds do not need to be consecutive.",
Elysium’s Call (Su),"With a touch, you can imbue creatures with the spirit of Elysium, lifting their spirits and freeing them from bonds. The creatures touched can immediately reroll any failed saving throws against spells and spell-like abilities of the enchantment (charm) and enchantment (compulsion) subschools. In addition, targets receive a +2 sacred bonus on such saving throws and a +2 sacred bonus on CMB checks to escape a grapple. Finally, targets can ignore up to 5 feet of difficult terrain each round, as if they had the Nimble Moves feat. These bonuses last for a number of rounds equal to 1/2 your cleric level (minimum 1), although the saving throw reroll only applies when the creature is touched. You can use this ability for a number of rounds per day equal to 3 + your Wisdom modifier.",
Powerful Bond (Su),"As a free action, you can open a link to communicate telepathically with a single ally within 60 feet. The telepathic link is two-way and lasts for 1 minute. Unlike normal telepathy, this ability requires a shared language. You can use this ability a number of times per day equal to 3 + your Wisdom modifier.",
Aura of Sanctification (Su)," At 8th level, as an immediate action, you can emit a 30-foot-radius aura of sanctification for a number of rounds per day equal to your cleric level. These rounds do not need to be consecutive. Within this aura, effects that are specifically harmful to good-aligned creatures are inverted so that they no longer harm good creatures and instead harm evil creatures. Similarly, effects that are specifically beneficial to evil creatures instead become beneficial only to good creatures.",
Rebuke Death (Sp),"You can touch a living creature as a standard action, healing it for 1d4 points of damage plus 1 for every two cleric levels you possess. You can only use this ability on a creature that is below 0 hit points. You can use this ability a number of times per day equal to 3 + your Wisdom modifier.",
Healer's Blessing (Su),"At 6th level, all of your cure spells are treated as if they were empowered, increasing the amount of damage healed by half (+50%). This does not apply to damage dealt to undead with a cure spell. This does not stack with the Empower Spell metamagic feat.",
Restorative Touch (Su),"You can touch a creature, letting the healing power of your deity flow through you to relieve the creature of a minor condition. Your touch can remove the dazed, fatigued, shaken, sickened, or staggered condition. You choose which condition is removed. You can use this ability a number of times per day equal to 3 + your Wisdom modifier.",
Gift of Life (Su),"At 8th level, you can touch a creature that has died within the past minute to grant it a few moments of life. The dead creature returns to life for a number of rounds equal to your cleric level. Creatures returned to life in this way have a number of hit points equal to half your cleric level, and continue to be affected by any still-active spells, conditions, or afflictions present at the time of their death. At the end of this time, the creature dies again. The creature is free to act as it sees fit during this time. You are granted no control over it.",
Lore Keeper (Sp),"You can touch a creature to learn about its abilities and weaknesses. With a successful touch attack, you gain information as if you made the appropriate Knowledge skill check with a result equal to 15 + your cleric level + your Wisdom modifier.",
Remote Viewing (Sp),"Starting at 6th level, you can use clairvoyance/clairaudience at will as a spell-like ability using your cleric level as the caster level. You can use this ability for a number of rounds per day equal to your cleric level. These rounds do not need to be consecutive.",
Void Form (Su),"At 6th level, you can become semi-tangible as a standard action. While in this form, you are immune to critical hits and gain a +1 deflection bonus to AC. This bonus increases by 1 at 8th level and every 4 levels thereafter. You can use this power a number of rounds per day equal to your cleric level. These rounds need not be consecutive.",
Teaching Moment (Su),"At 8th level, when you or an ally within 30 feet rolls a natural 1 or a natural 20 on an attack roll, an ability check, a skill check, or a saving throw, as an immediate action you can grant all allies within 30 feet special insights that help them overcome similar challenges. Once during the next minute, each affected creature can choose to roll twice and take the better result before attempting an attack roll, ability check, skill check, or saving throw. You can use this ability once per day at 8th level, and one additional time per day for every 4 cleric levels beyond 8th.",
Deep Cover (Su),"When you prepare your spells, you can also choose one cover identity—whether that of a real person or a fictitious one. You can assume the disguise of your cover identity in half the normal amount of time. When targeted by a spell or effect that would compromise your chosen disguise (such as detect evil, detect thoughts, or zone of truth), as an immediate action you can force the creature using the ability to attempt a Will save (DC = 10 + 1/2 your cleric level + your Wisdom modifier). If the creature fails, it gains false information in keeping with your cover identity. You can use this false information ability a number of times per day equal to 3 + your Wisdom modifier.",
Recall (Su),"With a touch, you can cause a creature to recall some bit of forgotten lore or information. The creature can retry any Knowledge skill check it has made within the past minute, gaining a insight bonus on the check equal to your Wisdom modifier. You can use this ability a number times per day equal to 3 + your Wisdom modifier.",
Read Minds (Su),"At 8th level, you can broaden your mental spectrum to encompass those around you. Doing so allows you to read the mind of every creature within 30 feet as if you had cast detect thoughts. This ability allows you to read the surface thoughts of any creature that you are aware of after only 1 round of concentration. Creatures in this area are allowed a Will save to negate the effect. The DC of this Will save is 10 + 1/2 your cleric level + your Wisdom modifier. You can use this ability for a number of rounds per day equal to your cleric level. These rounds do not need to be consecutive.",
Touch of Law (Sp),"You can touch a willing creature as a standard action, infusing it with the power of divine order and allowing it to treat all attack rolls, skill checks, ability checks, and saving throws for 1 round as if the natural d20 roll resulted in an 11. You can use this ability a number of times per day equal to 3 + your Wisdom modifier.",
Staff of Order (Su)," At 8th level, you can give a weapon touched the axiomatic special weapon quality for a number of rounds equal to 1/2 your cleric level. You can use this ability once per day at 8th level, and an additional time per day for every four levels beyond 8th.",
Aura of Menace (Su),"t 8th level, you can emit a 30-foot aura of menace as a standard action. Enemies in this aura take a –2 penalty to AC and on attacks and saves as long as they remain inside the aura. You can use this ability for a number of rounds per day equal to your cleric level. These rounds do not need to be consecutive.",
Hell’s Corruption (Su),"You can cause a creature to become more susceptible to corruption as a melee touch attack. Creatures touched take a –2 penalty on all saving throws and must roll all opposed skill checks twice, taking the worse result. This effect lasts for a number of rounds equal to 1/2 your cleric level (minimum 1). You can use this ability for a number of times per day equal to 3 + your Wisdom modifier.",
Command (Su),"As a standard action, you can give a creature an emotionless yet undeniable order, as per the spell command. A Will save negates this effect. You cannot target a creature more than once per day with this ability. You can use this ability a number of times per day equal to 3 + your Wisdom modifier.",
Chastisement (Su),"As a standard action, you can cast a strengthened spell against a creature that damaged you since your last turn. This spell must target the creature that damaged you, and is cast at +1 caster level. Area of effect spells cannot be used in conjunction with this ability, but other spells that target multiple creatures may be. You can use this ability a number of times per day equal to 3 + your Wisdom modifier.",
Pain Is Power (Su),"At 8th level, after taking damage from any source, you may attempt a DC 25 concentration check as an immediate action. If you succeed, you gain the benefits of a blessing of fervor spell for a number of rounds equal to 1/2 your cleric level. If you fail, this ability is expended with no effect. You can use this ability once at 8th level, plus an additional time for every 4 levels you are beyond 8th.",
Prohibition (Su),"As a standard action, you can command a creature within 30 feet to refrain from committing a particular action (including any referenced in the spell forbid action). If the creature performs the named action before the beginning of your next turn, it takes 1d6 points of damage + 1 point for every 2 cleric levels you possess and the effect ends. This is a language-dependent effect. You can use this ability a number of times per day equal to 3 + your Wisdom modifier.If you have the spell rune domain power, you can attach a spell effect to the prohibition as if it were the spell rune domain ability; the spell takes effect if the creature performs the named action. This spell must be of at least 1 level lower than the highest-level cleric spell you can cast, and it must target one or more creatures. Regardless of the number of targets the spell can normally affect, it affects only the creature that triggers the rune.
Touch of Loyalty (Su),"As a standard action, you can touch a willing creature, granting it a +4 sacred bonus on saving throws to resist charm, compulsion, and fear effects for 1 hour. You can use this ability a number of times per day equal to 3 + your Wisdom modifier.",
Master's Yoke (Su),"At 8th level, you can attempt to assert your dominance over any visible creature within 30 feet by declaring the target your property. The target can resist this effect with a successful Will save (DC = 10 + 1/2 your cleric level + your Wisdom modifier). If the target fails the save, it is affected as if by dominate monster for a number of rounds equal to 1/2 your cleric level, save that the target can choose to ignore any order you give and instead take 2 points of Constitution damage and become staggered for 1 round. You can use this ability once per day at 8th level, and an additional time per day for every 4 levels beyond 8th. This is a language-based mind-affecting effect.",
Tyrannical Strike (Su),"At 8th level, as an immediate action upon successfully hitting an opponent with a melee attack, you can choose to forgo the damage (but not any other effects of the attack) to instead affect the creature you hit as a greater command spell, with a caster level equal to your cleric level. You can use this ability once per day at 8th level, and an additional time per day for every 4 levels beyond 8th.",
Liberation (Su),"You have the ability to ignore impediments to your mobility. For a number of rounds per day equal to your cleric level, you can move normally regardless of magical effects that impede movement, as if you were affected by freedom of movement. This effect occurs automatically as soon as it applies. These rounds do not need to be consecutive.",
Freedom's Call (Su),"At 8th level, you can emit a 30-foot aura of freedom for a number of rounds per day equal to your cleric level. Allies within this aura are not affected by the confused, grappled, frightened, panicked, paralyzed, pinned, or shaken conditions. This aura only suppresses these effects, and they return once a creature leaves the aura or when the aura ends, if applicable. These rounds do not need to be consecutive.",
Liberty’s Blessing (Sp),"You touch a willing creature as a standard action, granting it a boon. A creature with this boon can, as a swift action, make a saving throw against a single spell or effect it is suffering from that grants a save. The DC of the saving throw is equal to the original DC of the spell or effect. If the saving throw is successful, the effect ends. This boon lasts for 1 minute or until successfully used to remove a spell or effect, whichever duration is shorter. You can use this ability for a number of times equal to 3 + your Wisdom modifier.",
Powerful Persuader (Su),"At 8th level, when you make a Diplomacy or Intimidate check, you can roll twice and take the higher result. Using this ability is a free action. You can use this ability once per day at 8th level, plus one additional time per day for every 2 levels beyond 8th.",
Bit of Luck (Sp),"You can touch a willing creature as a standard action, giving it a bit of luck. For the next round, any time the target rolls a d20, he may roll twice and take the more favorable result. You can use this ability a number of times per day equal to 3 + your Wisdom modifier.",
Good Fortune (Ex),"At 6th level, as an immediate action, you can reroll any one d20 roll you have just made before the results of the roll are revealed. You must take the result of the reroll, even if it's worse than the original roll. You can use this ability once per day at 6th level, and one additional time per day for every six cleric levels beyond 6th.",
Malign Eye (Su),"As a standard action, you can afflict one target within 30 feet with your malign eye, causing it to take a –2 penalty on all saving throws against your spells. The effect lasts for 1 minute or until the target hits you with an attack. You can use this ability for a number of times per day equal to 3 + your Wisdom modifier.",
Tugging Strands (Su),"At 8th level, you can force a creature within line of sight to reroll any one roll that it has just made before the result of the roll is revealed. The result of the reroll must be taken, even if it is worse than the original roll. You can use this ability once per day at 8th level, and one additional time per day for every 6 levels beyond 8th.",
Haze of Daydreams (Su),"At 6th level, you can emit a 15-foot-radius haze of daydreams for a number of rounds per day equal to your cleric level. These rounds do not need to be consecutive. Creatures within the haze gain the fascinated condition unless they succeed at a Will save (DC equal to 10 + 1/2 your cleric level + your Wisdom modifier). You may designate a number of creatures equal to your cleric level that are not affected by the haze. The fascinated condition ends immediately when the creatures leave the area or the aura expires.",
Vision of Madness (Sp),"You can give a creature a vision of madness as a melee touch attack. Choose one of the following: attack rolls, saving throws, or skill checks. The target receives a bonus to the chosen rolls equal to ½ your cleric level (minimum +1) and a penalty to the other two types of rolls equal to ½ your cleric level (minimum –1). This effect fades after 3 rounds. You can use this ability a number of times per day equal to 3 + your Wisdom modifier.",
Aura of Madness (Su),"At 8th level, you can emit a 30-foot aura of madness for a number of rounds per day equal to your cleric level. Enemies within this aura are affected by confusion unless they make a Will save with a DC equal to 10 + ½ your Cleric level + your Wisdom modifier. The confusion effect ends immediately when the creature leaves the area or the aura expires. Creatures that succeed on their saving throw are immune to this aura for 24 hours. These rounds do not need to be consecutive.",
Insane Focus (Su),"You can touch a willing creature as a standard action, granting it a +4 bonus on all saving throws made against mind-affecting effects and immunity to confusion. This bonus lasts for 1 minute. If the creature fails a saving throw against a mind-affecting effect during this period, it loses its immunity to confusion and is immediately confused for one round. You can use this ability a number of times per day equal to 3 + your Wisdom modifier.",
