Granted Powers,Description
Lightning Arc (Sp),"As a standard action, you can unleash an arc of electricity targeting any foe within 30 feet as a ranged touch attack. This arc of electricity deals 1d6 points of electricity damage + 1 point for every two cleric levels you possess. You can use this ability a number of times per day equal to 3 + your Wisdom modifier.",
Electricity Resistance (Ex),"At 6th level, you gain resist electricity 10. This resistance increases to 20 at 12th level. At 20th level, you gain immunity to electricity.",
Thundercloud (Su),"At 8th level, you can, as a standard action, summon a storm cloud. This power functions as fog cloud except that creatures inside the cloud are deafened and take 2d6 points of electricity damage each round from the flashes of thunder and lightning. Once created, you can concentrate on the cloud to move it up to 30 feet each round. You can use this ability for a number of rounds per day equal to your cleric level. These rounds do not need to be consecutive.",
Wind Blast (Su),"As a standard action, you can unleash a blast of air in a 30-foot line. Make a combat maneuver check against each creature in the line, using your caster level as your base attack bonus and your Wisdom modifier in place of your Strength modifier. Treat the results as a bull rush attempt. You can use this ability a number of times per day equal to 3 + your Wisdom modifier.",
Speak with Animals (Sp),"You can speak with animals, as per the spell, for a number of rounds per day equal to 3 + your cleric level.",
Animal Companion (Ex),"At 4th level, you gain the service of an animal companion. Your effective druid level for this animal companion is equal to your cleric level – 3. (Druids who take this ability through their nature bond class feature use their druid level – 3 to determine the abilities of their animal companions)."
Eyes of the Hawk (Ex),"You gain a racial bonus on Perception checks equal to 1/2 your cleric level (minimum +1). In addition, if you can act during a surprise round, you receive a +2 racial bonus on your Initiative check.",
Predator’s Grace (Su),"You can, as a swift action, grant yourself a +10-foot bonus to your base speed for 1 round. This bonus increases by 5 feet for every 5 cleric levels you possess. In addition, you gain low-light vision for 1 round. If you already possess low-light vision, the range of your sight becomes three times that of a human in dim light for 1 round. You can use this ability a number of times per day equal to 3 + your Wisdom modifier.",
Artificer's Touch (Sp),"You can cast mending at will, using your cleric level as the caster level to repair damaged objects. In addition, you can cause damage to objects and construct creatures by striking them with a melee touch attack. Objects and constructs take 1d6 points of damage +1 for every two cleric levels you possess. This attack bypasses an amount of damage reduction and hardness equal to your cleric level. You can use this ability a number of times per day equal to 3 + your Wisdom modifier."
Dancing Weapons (Su),"At 8th level, you can give a weapon touched the dancing special weapon quality for 4 rounds. You can use this ability once per day at 8th level, and an additional time per day for every four levels beyond 8th."
Animate Servant (Su),"At 8th level, as a standard action, you can give life to inanimate objects. This ability functions as animate objects using your cleric level as the caster level. You can use this ability once per day at 8th level, and one additional time per day for every four levels beyond 8th.",
Aura of Efficiency (Su),"At 8th level, you can emit a 30-foot-radius aura that grants your allies a +4 bonus on all saving throws against effects that inflict the fatigued or exhausted condition. Any equipment wielded by your allies within this area gets a bonus to hardness equal to 1/2 your cleric level, and your allies' attacks against targets within this area ignore an equal amount of hardness. You can use this aura for a number of rounds per day equal to your cleric level. These rounds do not need to be consecutive.",
Aura of Repetition (Su),"At 8th level, you can emit a 30- foot aura of repetition for a number of rounds per day equal to your cleric level. All enemies within this aura must make a Will save each round or repeat their action from the previous round (if possible). Creatures that attacked on the previous round attack again on the following round, although they may change their target. Creatures that moved the previous round must take the same move action again, although they may change their route. Creatures that drank a potion must do so again, even they can only drink from an empty bottle. Actions that cannot be repeated are wasted. These rounds do not need to be consecutive.",
Supernatural Trap (Su),"At 8th level, select a supernatural ranger trap. You can use this trap a number of times per day equal to your Wisdom bonus. The DCs for Perception checks, Disable Device checks, and saving throws against the trap are equal to 10 + 1/2 your character level + your Wisdom bonus. The trap lasts for 1 hour or until triggered.",
Touch of Chaos (Sp),"You can imbue a target with chaos as a melee touch attack. For the next round, anytime the target rolls a d20, he must roll twice and take the less favorable result. You can use this ability a number of times per day equal to 3 + your Wisdom modifier.",
Chaos Blade (Su),"At 8th level, you can give a weapon touched the anarchic special weapon quality for a number of rounds equal to 1/2 your cleric level. You can use this ability once per day at 8th level, and an additional time per day for every four levels beyond 8th.",
Elysium’s Call (Su),"With a touch, you can imbue creatures with the spirit of Elysium, lifting their spirits and freeing them from bonds. The creatures touched can immediately reroll any failed saving throws against spells and spell-like abilities of the enchantment (charm) and enchantment (compulsion) subschools. In addition, targets receive a +2 sacred bonus on such saving throws and a +2 sacred bonus on CMB checks to escape a grapple. Finally, targets can ignore up to 5 feet of difficult terrain each round, as if they had the Nimble Moves feat. These bonuses last for a number of rounds equal to 1/2 your cleric level (minimum 1), although the saving throw reroll only applies when the creature is touched. You can use this ability for a number of rounds per day equal to 3 + your Wisdom modifier.",
Faith-Stealing Strike (Su),"You can make a single melee attack using your highest base attack bonus against a creature capable of casting divine spells. If you damage the creature, it must succeed at a Will save (DC = 10 + 1/2 your cleric level + your Wisdom modifier) or be unable to cast any divine spells for 1 round. If you do not damage your target with the attack, this ability is expended with no effect. You can use this ability a number of times per day equal to 3 + your Wisdom modifier.",
Fury of the Abyss (Su),"As a swift action, you can give yourself an enhancement bonus equal to 1/2 your cleric level (minimum +1) on melee attacks, melee damage rolls, and combat maneuver checks. This bonus lasts for 1 round. During this round, you take a –2 penalty to AC. You can use this ability for a number of times per day equal to 3 + your Wisdom modifier.",
Hasten the End (Su),"At 8th level, as an immediate action upon successfully hitting an opponent with a melee attack, you reduce the remaining duration of all beneficial magical effects currently affecting the target by 1 round, minute, hour, or day—whichever measurement is used to determine the duration of each particular magical effect. You can use this ability once per day at 8th level, and an additional time per day for every 4 levels beyond 8th.",
Aura of Chaos (Su),"At 8th level, you can surround yourself with a field wild energies. These energies manifest as a 30-foot aura of chaos for a number of rounds per day equal to your cleric level. All enemies within this aura must declare one type of action at the start of their turn (attack, cast a spell, move, use an item, or activate a special ability) and make a Will save. Creatures that fail the Will save must take an action other than their declared action. If they succeed, they must take the declared action. Creatures cannot select actions that they cannot perform.",
Intense Celebration (Su),"At 8th level, any spells you cast that confer a morale effect upon you or your allies are automatically affected as if by the Extend Spell metamagic feat, with no increase in spell level.",
Aura of Bedlam (Su),"At 8th level, you can emit a 30-foot-radius aura of chaos and strife for 1 round per cleric level. Enemies in the aura take a –4 penalty on concentration checks and are treated as experiencing vigorous motion (concentration DC = 10 + spell level) when attempting to cast spells. This penalty increases by 1 for every 2 cleric levels you have beyond 8th.",
Unexpected Whimsy (Su),"As a standard action, you dance, act like a buffoon, or commit some other act of whimsy. When you do, enemies within 30 feet of you that can see and hear you must succeed a Will saving throw (DC = 10 + 1/2 your cleric level + half your Wisdom modifier) or they collapse into gales of manic laughter, falling prone. Those who fail their saving throws can take no actions other than laughing for 1 round, but are not considered helpless. You can use this ability once per day at 8th level and one additional time for every 4 levels you possess beyond 8th.",
Dazing Touch (Sp),"You can cause a living creature to become dazed for 1 round as a melee touch attack. Creatures with more Hit Dice than your cleric level are unaffected. You can use this ability a number of times per day equal to 3 + your Wisdom modifier.",
Charming Smile (Sp),"At 8th level, you can cast charm person as a swift action, with a DC of 10 + 1/2 your cleric level + your Wisdom modifier. You can only have one creature charmed in this way at a time. The total number of rounds of this effect per day is equal to your cleric level. The rounds do not need to be consecutive, and you can dismiss the charm at any time as a free action. Each attempt to use this ability consumes 1 round of its duration, whether or not the creature succeeds on its save to resist the effect.",
Adoration (Su)," As an immediate action, you can attempt to thwart a melee or ranged attack that targets you. This ability functions as sanctuary, but only against one individual attack. You must use the ability after the attack is declared but before the roll is made. The creature attacking you receives a Will save to negate this effect. If a creature has more than one attack, this ability only affects one of the attacks. You can use the ability a number of times per day equal to 3 + your Wisdom modifier. This is a mind-affecting effect.",
Anything to Please (Su),"At 8th level, you can compel a creature within 30 feet to attempt to please you as a standard action. The creature receives a Will save to negate this affect. If the save fails, the creature attacks your enemies for 1 round, gives you its most valuable item, or drops prone at your feet and grovels for 1d4 rounds (GM’s choice). You can use this ability once per day at 8th level and one additional time per day for every four levels beyond 8th. This is a mind-affecting effect.",
Calming Touch (Sp)," You can touch a creature as a standard action to heal it of 1d6 points of nonlethal damage + 1 point per cleric level. This touch also removes the fatigued, shaken, and sickened conditions (but has no effect on more severe conditions). You can use this ability a number of times per day equal to 3 + your Wisdom modifier.",
Unity (Su),"At 8th level, whenever a spell or effect targets you and one or more allies within 30 feet, you can use this ability to allow your allies to use your saving throw against the effect in place of their own. Each ally must decide individually before the rolls are made. Using this ability is an immediate action. You can use this ability once per day at 8th level, and one additional time per day for every four cleric levels beyond 8th.",
Synergistic Touch (Sp),"You can touch a creature as a standard action to confer upon it the benefits of any one Teamwork feat that you possess. This effect persists for a number of rounds equal to 1/2 your cleric level (minimum 1). You can use this ability a number of times per day equal to 3 + your Wisdom modifier.",
Teaching Moment (Su),"At 8th level, when you or an ally within 30 feet rolls a natural 1 or a natural 20 on an attack roll, an ability check, a skill check, or a saving throw, as an immediate action you can grant all allies within 30 feet special insights that help them overcome similar challenges. Once during the next minute, each affected creature can choose to roll twice and take the better result before attempting an attack roll, ability check, skill check, or saving throw. You can use this ability once per day at 8th level, and one additional time per day for every 4 cleric levels beyond 8th.",
Binding Ties (Su),"As a standard action, you can touch an ally and remove one condition affecting the ally by transferring it to yourself. This transfer lasts a number of rounds equal to your cleric level, but you can end it as a free action on your turn. At the end of this effect, the condition reverts to the original creature, unless it has ended or is removed by another effect. While this power is in use, the target is immune to the transferred condition. You can use this ability a number of times per day equal to 3 + your Wisdom modifier.",
Guarded Hearth (Su),"At 8th level, you can create a ward that protects a specified area. Creating this ward takes 10 minutes of uninterrupted work. This ward has a maximum radius of 5 feet per 2 cleric levels you possess. When the ward is completed, you designate any number of creatures inside its area. Should any other creature enter the warded area, all of the selected creatures are immediately alerted (and awoken if they were asleep). The designated creatures also receive a sacred bonus equal to your Wisdom modifier on all saving throws and attack rolls while inside the warded area. This ward immediately ends if you leave the area. The ward lasts for 1 hour per cleric level. You can use this ability once per day.",
Touch of Darkness (Sp),"As a melee touch attack, you can cause a creature's vision to be fraught with shadows and darkness. The creature touched treats all other creatures as if they had concealment, suffering a 20% miss chance on all attack rolls. This effect lasts for a number of rounds equal to 1/2 your cleric level (minimum 1). You can use this ability a number of times per day equal to 3 + your Wisdom modifier."
Eyes of Darkness (Su),"At 8th level, your vision is not impaired by lighting conditions, even in absolute darkness and magic darkness. You can use this ability for a number of rounds per day equal to 1/2 your cleric level. These rounds do not need to be consecutive.",
Aura of Forgetfulness (Su),"At 8th level, you can emit a 30- foot aura of forgetfulness for a number of rounds per day equal to your cleric level. Creatures you target in this area must make a Will save or have no memory of any time spent inside the area. In addition, spellcasters in the area lose one prepared spell or available spell slot per round spent in the area, starting with 1st-level spells and going up through higher-level spells. Spellcasters are allowed a save each round to negate this loss (this save is separate from the memory loss save). These rounds do not need to be consecutive.",
Moonfire (Su),"At 8th level, as a standard action you can shoot a blast of divine moonlight from your eyes, as a ranged touch attack against a single target within 30 feet. Moonfire deals 1d8 points of damage per 2 cleric levels, and the target is dazzled for 1 round per cleric level. Moonfire deals 1d10 points of damage per cleric level against lycanthropes. You can use this ability once per day at 8th level, and one additional time per day for every 4 levels beyond 8th.",
Night Hunter (Su),"As a standard action, you can blend into the shadows of the night, becoming nearly invisible. As long as you are in an area of dim light or darkness, you are invisible (as per invisibility) to creatures without darkvision. This ability lasts for a number of rounds equal to 1/2 your cleric level (minimum 1). You can use this ability for a number of times per day equal to 3 + your Wisdom modifier.",
Bleeding Touch (Sp),"As a melee touch attack, you can cause a living creature to take 1d6 points of damage per round. This effect persists for a number of rounds equal to 1/2 your cleric level (minimum 1) or until stopped with a DC 15 Heal check or any spell or effect that heals damage. You can use this ability a number of times per day equal to 3 + your Wisdom modifier.",
Death's Embrace (Ex),"At 8th level, you heal damage instead of taking damage from channeled negative energy. If the channeled negative energy targets undead, you heal hit points just like undead in the area.",
Killing Blow (Su),"At 8th level, weapons you use become infused with the power of death. Whenever you confirm a critical hit with a melee or ranged weapon, your attack deals an additional amount of bleed damage equal to half your cleric level. You can use this ability once per day at 8th level, plus one additional time per day for every four levels beyond 8th.",
Touch of Virulence (Su),"As a standard action, you can touch a diseased creature and exacerbate its condition. If it fails a Fortitude save (DC = 10 + 1/2 your cleric level + your Wisdom modifier), the creature takes damage as though it had failed its Fortitude save against the disease and any remaining onset time for the disease ends. You can use this ability once per day at 8th level, plus one additional time per day at 14th level and 20th level.",
Spirit Touch (Su),"At 6th level, as a swift action, you can give your natural weapons or any weapons you wield the ghost touch weapon special ability. You can use this power a number of rounds per day equal to your cleric level. These rounds need not be consecutive.",
Death’s Kiss (Su),"You can cause a creature to take on some of the traits of the undead with a melee touch attack. Touched creatures are treated as undead for the purposes of effects that heal or cause damage based on positive and negative energy. This effect lasts for a number of rounds equal to 1/2 your cleric level (minimum 1). It does not apply to the Turn Undead or Command Undead feats. You can use this ability a number of times per day equal to 3 + your Wisdom modifier.",
Destructive Smite (Su),"You gain the destructive smite power: the supernatural ability to make a single melee attack with a morale bonus on damage rolls equal to 1/2 your cleric level (minimum 1). You must declare the destructive smite before making the attack. You can use this ability a number of times per day equal to 3 + your Wisdom modifier.",
Destructive Aura (Su),"At 8th level, you can emit a 30-foot aura of destruction for a number of rounds per day equal to your cleric level. All attacks made against targets in this aura (including you) gain a morale bonus on damage equal to 1/2 your cleric level and all critical threats are automatically confirmed. These rounds do not need to be consecutive.",
Deadly Weather (Su),"At 8th level, you can unleash a furious call to the heavens, summoning forth an everchanging storm of destruction for a number of rounds per day equal to your cleric level. This storm has a radius of 5 feet per cleric level. Each round, the storm has one of the following effects: driving rain (–4 on all Perception checks and ranged attack rolls), howling winds (–8 on Fly skill checks and ranged attack rolls), heavy snow (all terrain is considered difficult), or lightning bolt (as call lightning). Other effects depending on the weather might also apply (at the GM’s discretion). You choose which effect takes place each round, but no effect may be repeated on the following round. These rounds do not need to be consecutive.",
Hateful Aura (Su),"At 8th level, you can emit a 30-foot aura of hatred for a number of rounds per day equal to your cleric level. These rounds need not be consecutive. Enemies within this aura must attempt a Will save (DC = 10 + 1/2 your cleric level + your Wisdom modifier). Characters who fail their save are filled with hatred, and cannot consider other characters allies for the purpose of any actions or use any teamwork feats. The effect ends immediately if the creature leaves the aura, you end the aura as a free action, or you expend all rounds of this ability.",
Rage (Su),"At 8th level, you can enter a fearsome rage, like a barbarian, for a number of rounds per day equal to your cleric level. At 12th and 16th level, you can select one rage power. You cannot select any rage power that possesses a level requirement, but otherwise your barbarian level is equal to 1/2 your cleric level. These rounds of rage stack with any rounds of rage you might have from levels of barbarian.",
Painful Smite (Su),"Prior to making a melee attack roll, you can choose to convert all damage from that strike into nonlethal damage, adding your Wisdom modifier to the damage. If you succeed in your attack, as a free action you can make an Intimidate check against your target to demoralize the target. You gain a bonus on your Intimidate check equal to the amount of nonlethal damage dealt by the painful smite. You can use this ability a number of times per day equal to 3 + your Wisdom modifier.",
Acid Dart (Sp),"As a standard action, you can unleash an acid dart targeting any foe within 30 feet as a ranged touch attack. This acid dart deals 1d6 points of acid damage + 1 point for every two cleric levels you possess. You can use this ability a number of times per day equal to 3 + your Wisdom modifier.",
Acid Resistance (Ex),"At 6th level, you gain resist acid 10. This resistance increases to 20 at 12th level. At 20th level, you gain immunity to acid.",
Tunnel Runner (Su),"At 8th level, you can move through tunnels and caves with ease. Activating this ability is a standard action. You can move across any stone surface as if under the effects of spider climb. You can also see very well in darkness, gaining darkvision out to a range of 60 feet. If you already possess darkvision, extend the range by 60 feet. While underground, you also gain an insight bonus equal to your cleric level on Stealth skill checks and an insight bonus equal to your Wisdom modifier on initiative checks. You can use this ability for 1 minute per day per cleric level you possess. These minutes do not need to be consecutive, but they must be spent in 1-minute increments.",
Metal Fist (Su),"As a swift action, you can turn your fists into metal for 1 round, allowing you to make unarmed strikes that deal 1d6 points of bludgeoning damage plus your Strength modifier. These unarmed strikes do not provoke attacks of opportunity, but attacking with both uses the two-weapon fighting rules as normal. In addition, these unarmed strikes ignore the hardness of items with a hardness of 10 or less. You can use this ability a number of times per day equal to 3 + your Wisdom modifier.",
Radiating Touch (Su),"As a standard action that provokes attacks of opportunity, you can irradiate any unattended object for a number of rounds equal to your cleric level. While an object is irradiated, it emits a faint aura of transmutation. Any creature that passes within 5 feet of the aura must succeed at a Will save (DC equal to 10 + 1/2 your cleric level + your Wisdom modifier) or become sickened. You're immune to this object's effect. You can use this ability a number of times per day equal to 3 + your Wisdom modifier.",
Touch of Evil (Sp),"You can cause a creature to become sickened as a melee touch attack. Creatures sickened by your touch count as good for the purposes of spells with the evil descriptor. This ability lasts for a number of rounds equal to 1/2 your cleric level (minimum 1). You can use this ability a number of times per day equal to 3 + your Wisdom modifier.",
Scythe of Evil (Su),"At 8th level, you can give a weapon touched the unholy special weapon quality for a number of rounds equal to 1/2 your cleric level. You can use this ability once per day at 8th level, and an additional time per day for every four levels beyond 8th.",
Consume the Enemy (Su),"As a full-round action that is considered an evil act and provokes attacks of opportunity, you can bite a helpless living or freshly killed creature, dealing 1d3 points of damage. By consuming the creature's flesh, you gain a +1 profane bonus on saving throw DCs for all spells, spell-like abilities, and supernatural abilities you use against creatures of the same type (and subtype, if humanoid or outsider) as the cannibalized creature. This effect lasts for a number of minutes equal to 1/2 your cleric level or until you use this ability against a different creature. At 5th, 10th, 15th, and 20th level, this bonus increases by 1 (+5 maximum). You can use this ability a number of times per day equal to 3 + your Wisdom modifier.",
