Granted Powers,Description
Fearful Touch (Su),"As a standard action, you can make a melee touch attack against a creature, causing it to experience terrible hallucinations for 1 round. During this time, the creature loses any immunity to fear effects it might possess and takes a –2 penalty on attack rolls made against you. In addition, the creature takes a penalty on Will saves made against fear effects equal to 1/2 your cleric level (minimum –1). This power is a mind-affecting effect. You can use this ability for a number of times per day equal to 3 + your Wisdom modifier.",
Hand of the Acolyte (Su),"You can cause your melee weapon to fly from your grasp and strike a foe before instantly returning. As a standard action, you can make a single attack using a melee weapon at a range of 30 feet. This attack is treated as a ranged attack with a thrown weapon, except that you add your Wisdom modifier to the attack roll instead of your Dexterity modifier (damage still relies on Strength). This ability cannot be used to perform a combat maneuver. You can use this ability a number of times per day equal to 3 + your Wisdom modifier.",
Dispelling Touch (Sp),"At 8th level, you can use a targeted dispel magic effect as a melee touch attack. You can use this ability once per day at 8th level and one additional time per day for every four cleric levels beyond 8th.",
Arcane Beacon (Su),"As a standard action you can become a beacon of arcane energy until the end of your next turn. The aura emanates 15 feet from you. All arcane spells cast within the aura either gain a +1 bonus to their caster level or increase their saving throw DC by +1. The caster chooses the benefit when she casts the spell. You can use this ability for a number of times per day equal to 3 + your Wisdom modifier.",
Divine Vessel (Su),"Whenever you are the target of a divine spell, you can, as a swift action, grant each ally within 15 feet of you a divine boon. This boon grants a +2 bonus on the next attack roll, skill check, or ability check made before the end of their next turn. You can use this ability a number of times per day equal to 3 + your Wisdom modifier.",
Inspiring Word (Sp),"As a standard action, you can speak an inspiring word to a creature within 30 feet. That creature receives a +2 morale bonus on attack rolls, skill checks, ability checks, and saving throws for a number of rounds equal to 1/2 your cleric level (minimum 1). You can use this power a number of times per day equal to 3 + your Wisdom modifier.",
Leadership (Ex),"At 8th level, you receive Leadership as a bonus feat. In addition, you gain a +2 bonus on your leadership score as long as you uphold the tenets of your deity (or divine concept if you do not venerate a deity).",
Noble Visage (Su),"You gain a +1 bonus on Charisma checks and Charisma-based skill checks against creatures that share your creature type (and subtype, if you are a humanoid). This bonus increases by 1 for every 5 levels you possess.As a standard action, you can touch an ally to grant her your noble visage bonus against creatures that share her creature type (or subtype) for 1 minute. When you use this ability, you lose your noble visage bonus for 1 minute. You can use this ability a number of times per day equal to 3 + your Wisdom modifier.",
Inspiring Command (Su),"As a standard action, you can issue an inspiring command to your allies. The inspiring command affects one ally plus one additional ally for every three cleric levels you possess, who must all be within 30 feet of you. Affected allies gain a +2 insight bonus on attack rolls, AC, combat maneuver defense, and skill checks for 1 round. This is a language-dependent mind-affecting effect.",
Sacrificial Bond (Su),"At 8th level, when an ally within 30 feet takes damage from an attack, you can, as an immediate action, transfer this damage to yourself. This power also transfers any effects that accompany the damage. The damage done to you cannot be reduced in any way. You can use this ability once per day at 8th level, plus on additional time per day at 14th level and 20th level.",
Wooden Fist (Su),"As a free action, your hands can become as hard as wood, covered in tiny thorns. While you have wooden fists, your unarmed strikes do not provoke attacks of opportunity, deal lethal damage, and gain a bonus on damage rolls equal to 1/2 your cleric level (minimum +1). You can use this ability for a number of rounds per day equal to 3 + your Wisdom modifier. These rounds do not need to be consecutive.",
Bramble Armor (Su)," At 6th level, you can cause a host of wooden thorns to burst from your skin as a free action. While bramble armor is in effect, any foe striking you with an unarmed strike or a melee weapon without reach takes 1d6 points of piercing damage + 1 point per two cleric levels you possess. You can use this ability for a number of rounds per day equal to your cleric level. These rounds do not need to be consecutive.",
Aura of Decay (Su),"At 8th level, you can emit a 30-foot aura of decay as a standard action. Living creatures in this aura (except you) take 1d6 points of damage per round as their flesh rots. They also take a cumulative –1 penalty to Strength each round they remain in the aura. Once outside the aura, the penalty fades at the rate of –1 per round, but it begins building again if they reenter the aura. Plant creatures take 2d6 points of damage per round. You can use this ability for a number of rounds per day equal to your cleric level. These rounds do not need to be consecutive.",
Enlarge (Su),"As a swift action you can enlarge yourself for 1 round, as if you were the target of the enlarge person spell. You can use this ability a number of times per day equal to 3 + your Wisdom modifier.",
Resistant Touch (Sp),"As a standard action, you can touch an ally to grant him your resistance bonus for 1 minute. When you use this ability, you lose your resistance bonus granted by the Protection domain for 1 minute. You can use this ability a number of times per day equal to 3 + your Wisdom modifier.",
Aura of Protection (Su),"At 8th level, you can emit a 30-foot aura of protection for a number of rounds per day equal to your cleric level. You and your allies within this aura gain a +1 deflection bonus to AC and resistance 5 against all elements (acid, cold, electricity, fire, and sonic). The deflection bonus increases by +1 for every four cleric levels you possess beyond 8th. At 14th level, the resistance against all elements increases to 10. These rounds do not need to be consecutive.",
Deflection Aura (Su),"Once each day, you can emit a 20- foot aura for a number of rounds equal to your cleric level. Allies within the aura gain a +2 deflection bonus to AC and combat maneuver defense.",
Sheltering Walls (Sp),"As a standard action, you can touch an ally to summon a floating blockade of stone, granting the ally the benefits of partial cover for 1 round plus 1 round for every 6 cleric levels you possess. This ability does not grant the ally enough cover to attempt a Stealth check or avoid provoking attacks of opportunity. If the ally benefits from any other form of cover against an attack, the bonuses to AC and on Reflex saving throws increase by 1. You can use this power a number of times per day equal to 3 + your Wisdom modifier.",
Purifying Touch (Su),"At 8th level, you can touch a willing creature with divine power, giving it a saving throw against each effect currently affecting it, using the original saving throw DC of the effect. Each successful saving throw ends the related effect. The creature can choose not to make a save against an effect. You can use this ability once per day at 8th level, plus one additional time per day at 14th and 20th level.",
Taboo (Su),"When a creature touches you or strikes you with a melee attack, you can activate this power as an immediate action. That creature takes a –1 penalty on saving throws for 1 minute. This penalty increases by 1 for every 5 levels you possess. When you use this ability, you lose your resistance bonus granted by the Protection domain for 1 minute. You can use this ability a number of times per day equal to 3 + your Wisdom modifier.",
Gentle Rest (Sp),"Your touch can fill a creature with lethargy, causing a living creature to become staggered for 1 round as a melee touch attack. If you touch a staggered living creature, that creature falls asleep for 1 round instead. Undead creatures touched are staggered for a number of rounds equal to your Wisdom modifier. You can use this ability a number of times per day equal to 3 + your Wisdom modifier.",
Ward Against Death (Su),"At 8th level, you can emit a 30-foot aura that wards against death for a number of rounds per day equal to your cleric level. Living creatures in this area are immune to all death effects, energy drain, and effects that cause negative levels. This ward does not remove negative levels that a creature has already gained, but the negative levels have no effect while the creature is inside the warded area. These rounds do not need to be consecutive.",
Speak With Dead (Su),"At 8th level, as a standard action, you can ask one question of a dead creature as if using speak with dead. The dead creature you are questioning does not gain a Will saving throw if your alignments are different. You can use this ability for a number of times per day equal to your cleric level.",
Spirit Touch (Su),"At 6th level, as a swift action, you can give your natural weapons or any weapons you wield the ghost touch weapon special ability. You can use this power a number of rounds per day equal to your cleric level. These rounds need not be consecutive.",
Touch the Spirit World (Su),"With a touch, you can empower a weapon to affect incorporeal creatures. The weapon touched deals half damage to incorporeal creatures, or full damage if it is a magic weapon. This benefit lasts for a number of rounds equal to your cleric level. You can use this ability a number of times per day equal to 3 + your Wisdom modifier.",
Ruin Touch (Su),"You can strengthen or weaken objects with your touch. With a melee touch attack, you can increase or decrease the hardness of an object (up to a 10-foot cube) or construct by an amount equal to half your druid level (minimum 1) for 1 minute. You cannot reduce an object's hardness below 0, and the same target cannot be affected by this ability more than once. You can use this ability a number of times per day equal to 3 + your Wisdom modifier.",
Remembrance (Sp),"At 4th level, when within a ruin or other structure that is no longer claimed by civilization, you can call upon the wisdom of the land and its long-dead residents. Once per day for every 4 druid levels you possess, you can cast divination as a spell-like ability. Additionally, if you are within ruins when you cast commune with nature, you gain information about the crumbling structures around you as though they were part of nature.",
Surefooted (Ex),"At 8th level, your speed is not reduced by difficult terrain unless the terrain has been magically manipulated to impede motion.",
Blast Rune (Sp),"As a standard action, you can create a blast rune in any adjacent square. Any creature entering this square takes 1d6 points of damage + 1 point for every two cleric levels you possess. This rune deals either acid, cold, electricity, or fire damage, decided when you create the rune. The rune is invisible and lasts a number of rounds equal to your cleric level or until discharged. You cannot create a blast rune in a square occupied by another creature. This rune counts as a 1st-level spell for the purposes of dispelling. It can be discovered with a DC 26 Perception skill check and disarmed with a DC 26 Disable Device skill check. You can use this ability a number of times per day equal to 3 + your Wisdom modifier.",
Spell Rune (Sp),"At 8th level, you can attach another spell that you cast to one of your blast runes, causing that spell to affect the creature that triggers the rune, in addition to the damage. This spell must be of at least one level lower than the highest-level cleric spell you can cast and it must target one or more creatures. Regardless of the number of targets the spell can normally affect, it only affects the creature that triggers the rune.",
Rune Shift (Su),"At 6th level, as a swift action, you can change the location of one of your blast runes. The rune must be within 30 feet. You can place the blast rune in any square adjacent to you, including one occupied by another creature.",
Prohibition (Su),"As a standard action, you can command a creature within 30 feet to refrain from committing a particular action (including any referenced in the spell forbid action). If the creature performs the named action before the beginning of your next turn, it takes 1d6 points of damage + 1 point for every 2 cleric levels you possess and the effect ends. This is a language-dependent effect. You can use this ability a number of times per day equal to 3 + your Wisdom modifier. If you have the spell rune domain power, you can attach a spell effect to the prohibition as if it were the spell rune domain ability; the spell takes effect if the creature performs the named action. This spell must be of at least 1 level lower than the highest-level cleric spell you can cast, and it must target one or more creatures. Regardless of the number of targets the spell can normally affect, it affects only the creature that triggers the rune. Attaching a spell in this way extends the duration of the prohibition by a number of rounds equal to the spell's level, or until it is discharged.",
Warding Rune (Su),At 6th level, when a creature is damaged by your blast rune, it cannot attack you for a number of rounds equal to 1/2 your cleric level unless it succeeds at a Will save, as per the spell sanctuary. Using this ability is an immediate action when a creature triggers one of your blast runes. The ability does not prevent you from being attacked or affected by area of effect spells or abilities. You can use this ability once per day at 8th level, plus one additional time per day at 14th level and 20th level.",
Venomous Stare (Sp),"You are a true lord of reptiles, able to induce pain, panic, and confusion with a mere glance, and your mesmerizing eyes can even drive weak creatures into unconsciousness. As a standard action, you can activate a gaze attack with a 30-foot range. This is an active gaze attack that can target a single creature within range. The target must make a Will save (DC = 10 + 1/2 your cleric level + your Wisdom modifier). Those who fail take 1d6 points of nonlethal damage + 1 point for every two cleric levels you possess and are fascinated until the beginning of your next turn. You can use this ability a number of times per day equal to 3 + your Wisdom modifier. This is a mind-affecting effect.",
Serpent Companion (Ex),"At 4th level, you gain the service of an animal companion. Your effective druid level for this animal companion is equal to your cleric level –2. You may choose either a viper or a constrictor snake as your companion.",
Dragonbreath (Su),"At 4th level, you may use a breath weapon once per day as a standard action. When you gain this ability, choose acid, cold, fire, or electricity—this determines what kind of damage your breath weapon deals. Once you make this choice, you cannot change it later. Your breath weapon fills a 15-foot cone, and deals 3d6 points of damage—this damage increases by 1d6 points at every even-numbered level you gain beyond 4th level. A creature hit by your dragonbreath attack can attempt a Reflex save (DC 10 + 1/2 your cleric level + your Wisdom modifier) to take half damage. At 9th level, you can use this ability two times per day, and at 1 4th level you can use it three times per day.",
Dinosaur Companion (Ex),"At 4th level, you gain the service of a loyal animal companion. Your effective druid level for this animal companion is equal to your cleric level – 2. You may only choose a dinosaur as your companion.",
Venomous Saliva (Su),"As a swift action, you can spit a gout of life-stealing venom onto a weapon you are wielding. The poison lasts for 1 minute or until you make an attack that injures a foe with that weapon. Life-Stealing Venom: Injury; save Fort DC 10 + 1/2 your cleric level + your Wisdom modifier; frequency 1/round for 3 rounds; effect 1 Con damage; cure 1 save. You can use the venomous saliva ability a number of times per day equal to 3 + your Wisdom modifier.",
Strength Surge (Sp),"As a standard action, you can touch a creature to give it great strength. For 1 round, the target gains an enhancement bonus equal to 1/2 your cleric level (minimum +1) to melee attacks, combat maneuver checks that rely on Strength, Strength-based skills, and Strength checks. You can use this ability a number of times per day equal to 3 + your Wisdom modifier.",
Might of the Gods (Su),"At 8th level, you can add your cleric level as an enhancement bonus to your Strength score for a number of rounds per day equal to your cleric level. This bonus only applies on Strength checks and Strength-based skill checks. These rounds do not need to be consecutive.",
Athletic Exploit (Su),"As a swift action, you gain the ability to overcome physical obstacles with ease. Until the beginning of your next turn, you halve your armor check penalty when attempting Acrobatics, Climb, Escape Artist, and Swim skill checks, and you gain a bonus equal to 1/2 your cleric level (minimum +1) on such skill checks.",
Ferocious Strike (Su),"Whenever you make a melee attack, you can designate that attack as a ferocious strike. If the attack hits, it deals additional damage equal to 1/2 your cleric level (minimum +1). You can use this ability a number of times per day equal to 3 + your Wisdom modifier.",
Wooden Fist (Su),"This ability acts as the Plant domain power of the same name.",
Bestow Resolve (Su),"At 8th level, you can bless creatures with the boldness of your deity. You can bestow a number of temporary hit points equal to your level + your Wisdom modifier to all allies within 20 feet. The temporary hit points remain for 1 minute. You can use this ability once per day at 8th level, plus one additional time per day for every 4 levels you possess beyond 8th.",
Sun's Blessing (Su),"Whenever you channel positive energy to harm undead creatures, add your cleric level to the damage dealt. Undead do not add their channel resistance to their saves when you channel positive energy.",
Nimbus of Light (Su),"At 8th level, you can emit a 30-foot nimbus of light for a number of rounds per day equal to your cleric level. This acts as a daylight spell. In addition, undead within this radius take an amount of damage equal to your cleric level each round that they remain inside the nimbus. Spells and spell-like abilities with the darkness descriptor are automatically dispelled if brought inside this nimbus. These rounds do not need to be consecutive.",
Day’s Resurgence (Su),"At 8th level, you can restore a single creature as if it had just completed 8 hours of rest. It takes 10 minutes to use this power. If the use of this power is disrupted, it must be restarted, but it is not lost. At the end of the 10 minutes, a single willing creature that you have touched regains hit points as if it had rested for the night and may make new saving throws against effects that require a save once per day. The target does not suffer any negative effects if such saving throws are failed, but success counts toward removing the affliction (if possible). This ability does not allow a target to prepare spells an additional time per day. You can use this ability once per day at 8th level, plus one additional time per day for every 2 levels beyond 8th.",
Blinding Flash (Su),"As a standard action, you can emit a flash of light from your holy symbol or divine focus. The most powerful light emanates out 20 feet from you. Creatures with fewer Hit Dice than your cleric level within this area are blinded for 1d4 rounds unless they succeed at a Fortitude save. All creatures in this area are dazzled for a number of rounds equal to 1/2 your cleric level (minimum 1). You can use this ability a number of times per day equal to 3 + your Wisdom modifier",
Guided Eyes (Su),"Perception is always a class skill for you. In addition, whenever you make a skill check to see through a disguise or find something that is hidden or concealed, you gain a +4 sacred bonus on the check.",
Agile Feet (Su),"As a free action, you can gain increased mobility for 1 round. For the next round, you ignore all difficult terrain and do not take any penalties for moving through it. You can use this ability a number of times per day equal to 3 + your Wisdom modifier.",
Dimensional Hop (Sp),"At 8th level, you can teleport up to 10 feet per cleric level per day as a move action. This teleportation must be used in 5-foot increments and such movement does not provoke attacks of opportunity. You must have line of sight to your destination to use this ability. You can bring other willing creatures with you, but you must expend an equal amount of distance for each creature brought.",
Door Sight (Su),"You can lay your hand upon any surface and see what is on the other side, as if using clairvoyance. Using this power takes 1 minute, during which time you must be touching the surface you want to see through. You can keep looking for as long as 10 minutes with each use of this power, but must touch the surface and take no other action the entire time. The surface cannot be thicker than 6 inches plus 1 inch per cleric level you possess. You can use this power a number of times per day equal to 3 + your Wisdom modifier.",
Silver-Tongued Haggler (Su),"Whenever you make a Bluff, Diplomacy, or Sense Motive check, you can, as a free action, grant yourself a bonus on the roll equal to 1/2 your cleric level (minimum +1). You can use this ability a number of times per day equal to 3 + your Wisdom modifier.",
Copycat (Sp),"You can create an illusory double of yourself as a move action. This double functions as a single Mirror Image and lasts for a number of rounds equal to your cleric level, or until the illusory duplicate is dispelled or destroyed. You can have no more than one copycat at a time. This ability does not stack with the Mirror Image spell. You can use this ability a number of times per day equal to 3 + your Wisdom modifier.",
Master's Illusion (Sp),"At 8th level, you can create an illusion that hides the appearance of yourself and any number of allies within 30 feet for 1 round per cleric level. This ability otherwise functions like the spell veil. The save DC to disbelieve this effect is equal to 10 + 1/2 your cleric level + your Wisdom modifier. The rounds do not need to be consecutive.",
Chameleon Aspect (Su),"As a swift action, you can subtly alter the color of your scales, blending them with the surrounding environment. While under the effect of this power, you gain concealment from creatures more than 10 feet away (attacks have a 20% miss chance), and total concealment from creatures more than 40 feet away (attacks have a 50% miss chance). You can use this ability a number of rounds per day equal to 3 + your Wisdom modifier.",
Sudden Shift (Sp),"In the blink of an eye, you can appear somewhere else. As an immediate action, after you are missed by a melee attack, you can teleport up to 10 feet to a space that you can see. This space must be inside the reach of the creature that attacked you. You can use this power a number of times each day equal to 3 + your Wisdom modifier.",
Deep Cover (Su),"When you prepare your spells, you can also choose one cover identity—whether that of a real person or a fictitious one. You can assume the disguise of your cover identity in half the normal amount of time. When targeted by a spell or effect that would compromise your chosen disguise (such as detect evil, detect thoughts, or zone of truth), as an immediate action you can force the creature using the ability to attempt a Will save (DC = 10 + 1/2 your cleric level + your Wisdom modifier). If the creature fails, it gains false information in keeping with your cover identity. You can use this false information ability a number of times per day equal to 3 + your Wisdom modifier.",
More for Me (Su),"When another character within 30 feet casts a spell with a range greater than touch, you can attempt a caster level check as an immediate action (DC = 15 + the spell's level). If you succeed at the check, you receive the spell's benefit instead of one of the spell's intended targets (chosen by you). If you are already a target of the spell, you are affected as though you were targeted by the same spell twice (which may or may not benefit you; remember that bonuses from the same source do not stack). This ability does not grant you knowledge of the spell being cast. You can use this ability a number of times per day equal to 3 + your Wisdom modifier.",
Fool's Privilege (Su),"You can use this power as a swift action when you fail a Bluff, Diplomacy, or Intimidate check outside of combat. You suffer no negative effects due to the failed check, and the next round you can attempt the check again without the usual penalty for a failed attempt.",
Thief of the Gods (Su),"At 8th level, when you make a Disable Device or Sleight of Hand check, you can roll twice and take the higher result. Using this ability is a free action. You can use this ability once per day at 8th level, plus one additional time per day for every 2 levels beyond 8th.",
Familiar,"You gain a greensting scorpion familiar. Your effective wizard level for this ability is equal to your druid level. Your druid level stacks with levels from other classes that grant familiars when determining the powers of your familiar.",
