we_id VARCHAR(30),we_name VARCHAR(30),category VARCHAR(30),handedness VARCHAR(30),base_price REAL,damage_dt INTEGER,damage_dn INTEGER,size VARCHAR(20),crit_rng INTEGER,crit_m INTEGER,range INTEGER DEFAULT -1,weight REAL,dam_type VARCHAR(30),description TEXT
140,Whip,exotic weapon,one,1,3,1,tiny,20,2,-1,2,S,"""A whip deals no damage to any creature with an armor bonus of +1 or higher or a natural armor bonus of +3 or higher. The whip is treated as a melee weapon with a 15-foot reach, though you don't threaten the area into which you can make an attack. In addition, unlike most other weapons with reach, you can use it against foes anywhere within your reach (including adjacent foes). Using a whip provokes an attack of opportunity, just as if you had used a ranged weapon."""
141,Bo staff,exotic weapon,two,1,6,1,medium,20,2,-1,3,B,"""Similar to a quarterstaff, only more slender and tapered at one end, the bo staff is both a defensive device and a weapon."""
142,Chain spear,exotic weapon,two,15,6,1,medium,20,2,-1,13,P and S,"""This vicious weapon is often used in gladiatorial events due to its versatility. The body of the weapon is a standard short spear, primarily used for thrusting. The butt of the spear is fitted with a length of chain, often spiked, with a hook at the end. The hook and chain may be used to make trip attacks. If your trip attack fails by 10 or more, you may drop the chain spear to avoid being knocked prone."""
143,Dire flail,exotic weapon,two,90,8,1,medium,20,2,-1,10,B,"""A dire flail consists of two spheres of spiked iron dangling from chains at opposite ends of a long haft. This weapon excels at short but powerful strikes, and is typically swung in a constant churning motion. The wielder of a dire flail must have great strength, both to use the weapon effectively and to keep from tiring out."""
144,Double walking stick katana,exotic weapon,two,50,6,1,medium,20,3,-1,6,B,"""This single case conceals a pair of matched fighting swords perfectly balanced to be wielded as a pair. Despite their name, the blades more closely resemble the shorter wakizashi. When the blades are concealed in their case, this weapon can be used as a quarterstaff."""
145,Double-chained kama,exotic weapon,two,8,6,1,medium,20,2,-1,4,S,"""This weapon comprises a pair of kama connected with an 8-foot length of chain. The wielder can attack as if armed with a single kama in each hand or extend the chain to make a single reach attack. By swinging the chain, the wielder can whip the kama about to disarm or trip opponents. Furthermore, if one of the weapons is dropped, the wielder can retrieve it as a free action by pulling on the chain."""
146,Dwarven urgrosh,exotic weapon,two,50,6,1,medium,20,3,-1,12,P or S,"""A dwarven urgrosh is a double weapon—an axe head and a spear point on opposite ends of a long haft. The urgrosh's axe head is a slashing weapon that deals 1d8 points of damage. Its spear head is a piercing weapon that deals 1d6 points of damage. You can use either head as the primary weapon; the other becomes the off-hand weapon. If you use an urgrosh against a charging character, the spear head is the part of the weapon that deals damage. Dwarves treat dwarven urgroshes as martial weapons."""
147,Elven curve blade,exotic weapon,two,80,10,1,medium,18,2,-1,7,S,"""Essentially a longer version of a scimitar, but with a thinner blade, the elven curve blade is exceptionally rare. You receive a +2 circumstance bonus to your CMD whenever a foe attempts to sunder your elven curve blade because of its flexible metal. You can use the Weapon Finesse feat to apply your Dexterity modifier instead of your Strength modifier on attack rolls with an elven curve blade that is sized for you, even though it isn't a light weapon."""
148,Flying blade,exotic weapon,two,40,12,1,medium,20,3,-1,12,S,"""A flying blade is a large, crescent-shaped blade anchored to a 10-foot chain. You fight with a flying blade by spinning it about your head or by snapping it toward an opponent. Because the flying blade is a clumsy weapon, you receive a –2 penalty on attack rolls with it, but when you make attacks of opportunity provoked by movement, you receive a +2 bonus on attack rolls instead of the penalty."
149,Gnome hooked hammer,exotic weapon,two,20,6,1,medium,20,4,-1,6,B or P,"""A gnome hooked hammer is a double weapon—an ingenious tool with a hammer head at one end of its haft and a long, curved pick at the other. The hammer's blunt head is a bludgeoning weapon that deals 1d6 points of damage (critical multiplier ×3). Its hook is a piercing weapon that deals 1d4 points of damage (critical multiplier ×4). You can use either head as the primary weapon. Gnomes treat hooked hammers as martial weapons."""
150,Harpoon,exotic weapon,two,5,8,1,medium,20,3,10,16,P,"""A harpoon is a barbed spear with an attached rope 50 feet or less in length. Most harpoons have metal points, but some use ivory or are made entirely of wood. If you are proficient with the harpoon, it is a grappling weapon. A harpoon's weight includes 10 pounds for the weight of 50 feet of hemp rope. The weight can be reduced by using shorter or lighter rope. If you are not proficient with a harpoon, treat it like a spear."""
151,Kusarigama,exotic weapon,two,12,6,1,medium,20,2,-1,3,S or B,"""This weapon has a single kama or sickle held in the off hand, attached by 10 feet of fine chain to a weighted metal ball. The sickle can be used to make trip attacks, jabs, and blocks, while the ball is whipped around at high speeds and then smashed into the opponent, or used to tangle an opponent's sword or spear, allowing the wielder to then attack with the sickle."""
152,Kyoketsu shoge,exotic weapon,two,6,4,1,medium,20,2,20,1,S or P,"""This weapon consists of a foot-long double-edged blade, with another smaller, curved hook-blade sticking out the side like a rooster's spur. The blade is strung to a large iron hoop with a 10-foot length of rope. The blade can be used as an off-handed melee weapon or thrown like a dagger, while the rope and circlet can be whipped around and swung at opponents as a bludgeoning reach weapon."""
153,Mancatcher,exotic weapon,two,15,2,1,medium,20,0,-1,10,P,"""This polearm consists of two curved metal bands that close around a target when you attack, allowing you to bind an opponent. A mancatcher is built to capture a creature of a particular size category (such as Small or Medium) and doesn't work on creatures of the wrong size. Make a touch attack to hit an opponent and a combat maneuver check to grapple him (without the –4 penalty for not having two hands free); success means you and the target are grappled. Once the target is grappled, you can perform a move or damage grapple action against him. The mancatcher has hardness 10 and 5 hit points; breaking it requires a DC 26 Strength check. If you drop the mancatcher, the target can free himself as a standard action."""
154,Meteor hammer,exotic weapon,two,10,8,1,medium,20,2,-1,10,B,"""This weapon consists of one or two spherical weights attached by a 10-foot chain. You whirl the weights and wrap them around an opponent's body. If you succeed at a trip attempt with a meteor hammer, you can drag your opponent 5 feet closer to you rather than knocking her prone. You may use this weapon in two different ways: In meteor mode you use it as a double weapon, while in fortress mode you cannot use it as a double weapon but gain reach and a +1 shield bonus to AC. Switching between these two modes is a free action decided at the start of your turn."""
155,Orc double axe,exotic weapon,two,60,8,1,medium,20,3,-1,15,S,"""A cruel weapon with blades placed at opposite ends of a long haft, an orc double axe is a double weapon. Though invented by and traditionally associated with orcs, the double axe can be crafted and wielded by other races as well, though many disdain it for its extreme weight and clumsiness. Because of the blades at either end of the axe, the wielder must hold an orc double axe in the middle of its haft, and utilize a weaving, slashing fighting style more akin to that of a quarterstaff than to that of a greataxe or battleaxe."""
156,Seven-branched sword,exotic weapon,two,50,10,1,medium,20,3,-1,7,S,"""This unusual sword has a straight 2-foot-long blade with six shorter L-shaped blades protruding from it, three on each side in a staggered pattern. The shorter blades can be used to snag opponents' clothing or armor, or can target weapons in order to disarm them. To snag armor or clothing, the attacker makes a trip attempt. If successful, the victim doesn't fall prone, but instead is snagged and stumbles forward, leaving the victim flat-footed for the remainder of the round."""
157,Spiked chain,exotic weapon,two,25,4,2,medium,20,2,-1,10,P,"""A spiked chain is about 4 feet in length and covered in wicked barbs. Some have metal hoops to use as handgrips. You can use the Weapon Finesse feat to apply your Dexterity modifier instead of your Strength modifier to attack rolls with a spiked chain sized for you, even though it isn't a light weapon."""
158,Tetsubo,exotic weapon,two,20,10,1,medium,20,4,-1,10,B,"""A slight improvement over the greatclub, this weapon consists of a long, slender length of wood or metal whose upper half is shod with a thick sheet of studded iron. The iron gives added weight and strength to the club, while the studs are designed to crack helmets and armor."""
159,Two-bladed sword,exotic weapon,two,100,8,1,medium,19,2,-1,10,S,"""A two-bladed sword is a double weapon—twin blades extend from either side of a central, short haft, allowing the wielder to attack with graceful but deadly flourishes."""
160,Bolas,exotic weapon,two,5,4,1,medium,20,2,10,2,B,"""A bolas is a pair of wooden, stone, or metal weights connected by a thin rope or cord. You can whirl and throw this weapon to make a ranged trip attack against an opponent. You can't be tripped during your own trip attempt when using a bolas."""
161,Boomerang,exotic weapon,two,3,6,1,medium,20,2,30,3,B,"""The boomerang is primarily a hunting tool, but it is not uncommon for these versatile thrown weapons to be carried into battle. A boomerang is made of wood and is flat, with a long haft, a pronounced forward curve, and a sharp backward bend at the head. A hunting boomerang does not fly in a returning path."""
162,Double crossbow,exotic weapon,two,300,8,1,medium,19,2,80,18,P,"""This heavy weapon fires a pair of iron-tipped bolts with a single squeeze of the trigger. Because of its size and weight, you take a –4 penalty on your attack roll if you're proficient with it, or –8 if you're not. If the attack hits, the target takes damage from both bolts. Critical hits, sneak attack damage, and other precision-based damage apply to only the first bolt. Reloading one bolt is a standard action; the Rapid Reload feat reduces this to a move action. Crossbow Mastery allows you to reload both bolts as a move action. A double crossbow fires crossbow bolts."""
163,Halfling sling staff,exotic weapon,two,20,8,1,medium,20,3,80,3,B,"""Made from a specially designed sling attached to a short club, a halfling sling staff can be used by a proficient wielder to devastating effect. Your Strength modifier applies to damage rolls when you use a halfling sling staff, just as it does for thrown weapons. You can fire, but not load, a halfling sling staff with one hand. Loading a halfling sling staff is a move action that requires two hands and provokes attacks of opportunity. A halfling sling staff fires bullets. You can hurl ordinary stones with a halfling sling staff, but stones are not as dense or as round as bullets. Thus, such an attack deals damage as if the weapon were designed for a creature one size category smaller than you and you take a –1 penalty on attack rolls. A halfling sling staff can be used as a simple weapon that deals bludgeoning damage equal to that of a club of its size. Halflings treat halfling sling staves as martial weapons."""
164,Hand crossbow,exotic weapon,two,100,4,1,medium,19,2,30,2,P,"""You can draw a hand crossbow back by hand. Loading a hand crossbow is a move action that provokes attacks of opportunity. A hand crossbow fires standard crossbow bolts, like those used by light and heavy crossbows. You can shoot, but not load, a hand crossbow with one hand at no penalty. You can shoot a hand crossbow with each hand, but you take a penalty on attack rolls as if attacking with two light weapons."""
165,Kestros,exotic weapon,two,1,8,1,medium,20,3,50,1,P,"""The kestros is an oddly shaped Bronze Age sling used for launching kestros darts. Your Strength modifier applies on damage rolls when you use a kestros, just as it does for thrown weapons. You can fire—but not load—a kestros with one hand. Loading a kestros is a move action that requires two hands and provokes attacks of opportunity. Halflings treat the kestros as a martial weapon."""
166,Lasso,exotic weapon,two,1,0,0,medium,20,0,-1,5,,"""This thrown weapon is a length of rope with a simple open knot on one end that allows you entangle a foe like you would using a net. The DC to cast a spell while entangled with a lasso is 10 + the spell level being cast. An entangled creature can slip free with a successful DC 15 Escape Artist check as a full-round action. The lasso has 2 hit points and AC 10, and requires a DC 23 Strength check to break it. On a successful hit, the lasso tightens; to use it again you must spend a standard action sliding the knot to enlarge the loop."""
167,Net,exotic weapon,two,20,0,0,medium,20,0,10,6,,"""A net is used to entangle enemies. When you throw a net, you make a ranged touch attack against your target. A net's maximum range is 10 feet. If you hit, the target is entangled. An entangled creature takes a –2 penalty on attack rolls and a –4 penalty to Dexterity, can move at only half speed, and cannot charge or run. If you control the trailing rope by succeeding at an opposed Strength check while holding it, the entangled creature can move only within the limits that the rope allows. If the entangled creature attempts to cast a spell, it must succeed at a concentration check with a DC of 15 + the spell's level or be unable to cast the spell. An entangled creature can escape with a successful DC 20 Escape Artist check (a full-round action). The net has 5 hit points and can be burst with a successful DC 25 Strength check (also a full-round action). A net is useful only against creatures within one size category of you. A net must be folded to be thrown effectively. The first time you throw your net in a fight, you make a normal ranged touch attack roll. After the net is unfolded, you take a –4 penalty on attack rolls with it. It takes 2 rounds for a proficient user to fold a net and twice that long for a nonproficient one to do so."""
168,Repeating hand crossbow,exotic weapon,two,800,4,1,medium,19,2,30,4,P,"""The repeating heavy crossbow holds 5 repeating crossbow bolts. As long as it holds bolts, you can reload it by pulling the reloading lever (a free action). Loading a new case of 5 bolts is a full-round action that provokes attacks of opportunity. You can fire a repeating crossbow with one hand or fire a repeating crossbow in each hand in the same manner as you would a normal crossbow of the same size. However, you must fire the weapon with two hands in order to use the reloading lever, and you must use two hands to load a new case of bolts."""
169,Repeating heavy crossbow,exotic weapon,two,400,10,1,medium,19,2,120,12,P,"""The repeating heavy crossbow holds 5 repeating crossbow bolts. As long as it holds bolts, you can reload it by pulling the reloading lever (a free action). Loading a new case of 5 bolts is a full-round action that provokes attacks of opportunity. You can fire a repeating crossbow with one hand or fire a repeating crossbow in each hand in the same manner as you would a normal crossbow of the same size. However, you must fire the weapon with two hands in order to use the reloading lever, and you must use two hands to load a new case of bolts."""
170,Repeating light crossbow,exotic weapon,two,250,8,1,medium,19,2,80,6,P,"""This weapon functions identically to a repeating heavy crossbow, except its damage, critical, and range values are equivalent to those of a hand crossbow instead."""
171,Rope dart,exotic weapon,two,1,4,1,medium,20,2,20,0,P,"""This deceptively complex weapon appears to be nothing more than a 12-foot rope attached to a 6-inch-long, conical metal spike. Similar to a meteor hammer, it can be whirled at great speeds, then aimed to strike and pierce opponents with great reach. Once it strikes, the wielder can quickly retrieve the weapon with a tug of the rope as a free action."""
172,Shuriken 5,exotic weapon,two,1,2,1,medium,20,2,10,0.5,P,"""A shuriken is a small piece of metal with sharpened edges, designed for throwing. A shuriken can't be used as a melee weapon. Although they are thrown weapons, shuriken are treated as ammunition for the purposes of drawing them and crafting masterwork or otherwise special versions of them, and of what happens to them after they are thrown."""
173,Snag net,exotic weapon,two,30,0,0,medium,20,0,10,10,P,"""This short, wide net is covered in barbed loops and slipknots. It works like a typical net, except it has the trip weapon special feature. If you entangle an opponent and hold the trailing rope, on your turn in place of a melee attack you may make a combat maneuver check to trip against that opponent; if you succeed, you may trip your opponent or deal 1 point of piercing damage to it. The concentration DC to cast while entangled in a snag net is 17 + the spell's level. The Escape Artist DC to escape a snag net is 22."""
174,Throwing shield,exotic weapon,two,50,6,1,medium,20,2,20,0,B,"""This shield is designed for throwing and has specially designed straps that allow you to unclasp and throw it as a free action. Tower shields cannot be throwing shields. Neither a shield's enhancement bonus to AC nor its shield spikes apply on your attack or damage rolls. A throwing shield can't be disarmed."""
